{
  "protein_ids": [
    "Q5VSL9",
    "protein2",
    "protein3",
    "protein4",
    "protein5",
    "protein6"
  ],
  "features": {
    "category": {
      "values": ["toxin", "enzyme", null],
      "colors": [
        "rgba(255,0,0,0.8)",
        "rgba(0,0,255,0.8)",
        "rgba(128,128,128,0.8)"
      ],
      "shapes": ["circle", "square", "triangle"]
    },
    "family": {
      "values": ["3FTx", "PLA2", null, "SVMP"],
      "colors": [
        "rgba(0,255,0,0.8)",
        "rgba(255,165,0,0.8)",
        "rgba(128,0,128,0.8)",
        "rgba(0,0,255,0.8)"
      ],
      "shapes": ["diamond", "cross", "square", "star"]
    }
  },
  "feature_data": {
    "category": [0, 1, 2, 1, 0, 1],
    "family": [0, 1, 2, 0, 3, 2]
  },
  "projections": [
    {
      "name": "UMAP",
      "metadata": {
        "n_neighbors": 20,
        "min_dist": 0.1,
        "metric": "euclidean"
      },
      "data": [
        [1.234, -0.567],
        [-0.707, 0.122],
        [0.5, 0.75],
        [1.0, -1.0],
        [1.4, 0.0],
        [0.0, 0.0]
      ]
    },
    {
      "name": "PCA",
      "data": [
        [0.5, 1.0],
        [-1.2, 0.8],
        [0.0, -0.5],
        [1.1, -1.0],
        [0.3, 1.2],
        [0.8, -0.2]
      ]
    }
  ]
}
